DEVICE ID 1fc9:000c on Bus 001 Address 002 =================
 bLength                :   0x12 (18 bytes)
 bDescriptorType        :    0x1 Device
 bcdUSB                 :  0x200 USB 2.0
 bDeviceClass           :    0x0 Specified at interface
 bDeviceSubClass        :    0x0
 bDeviceProtocol        :    0x0
 bMaxPacketSize0        :   0x40 (64 bytes)
 idVendor               : 0x1fc9
 idProduct              : 0x000c
 bcdDevice              :  0x104 Device 1.04
 iManufacturer          :    0x1 NXP Semiconductors
 iProduct               :    0x2 LPC18xx Memory
 iSerialNumber          :    0x3 TSA7 #0000001
 bNumConfigurations     :    0x1
  CONFIGURATION 1: 100 mA ==================================
   bLength              :    0x9 (9 bytes)
   bDescriptorType      :    0x2 Configuration
   wTotalLength         :   0x1b (27 bytes)
   bNumInterfaces       :    0x1
   bConfigurationValue  :    0x1
   iConfiguration       :    0x0
   bmAttributes         :   0xc0 Self Powered
   bMaxPower            :   0x32 (100 mA)
    INTERFACE 0: Application Specific ======================
     bLength            :    0x9 (9 bytes)
     bDescriptorType    :    0x4 Interface
     bInterfaceNumber   :    0x0
     bAlternateSetting  :    0x0
     bNumEndpoints      :    0x0
     bInterfaceClass    :   0xfe Application Specific
     bInterfaceSubClass :    0x1
     bInterfaceProtocol :    0x1
     iInterface         :    0x4 DFU

['0x9', '0x21', '0x7', '0x0', '0xff', '0x0', '0x8', '0x0', '0x1']
ext 33
262
    INTERFACE 0: Application Specific ======================
     bLength            :    0x9 (9 bytes)
     bDescriptorType    :    0x4 Interface
     bInterfaceNumber   :    0x0
     bAlternateSetting  :    0x0
     bNumEndpoints      :    0x0
     bInterfaceClass    :   0xfe Application Specific
     bInterfaceSubClass :    0x1
     bInterfaceProtocol :    0x1
     iInterface         :    0x4 DFU
result array('B', [0, 0, 0, 0, 9, 0])
bStatus 0
bwPollTimeout 0
bState 9
iString 0
	setalt None
result array('B', [0, 0, 0, 0, 9, 0])
bStatus 0
bwPollTimeout 0
bState 9
iString 0